{
  "id": "empty_subscription",
  "now": "2026-07-25T12:00:00+00:00",
  "account": {
    "source": "codexbar",
    "provider": "copilot",
    "billing_kind": "subscription_window",
    "windows": [
      {
        "label": "GitHub Copilot premium requests",
        "used_percent": 100.0,
        "remaining_percent": 0.0,
        "resets_at": "2026-08-01T00:00:00+00:00",
        "window_minutes": 44640
      }
    ]
  },
  "config": {
    "analysis": {
      "scoring_mode": "pace",
      "learn_from_history": false,
      "pace": {
        "waste_alert_fraction": 0.3,
        "min_elapsed_fraction": 0.15,
        "conserve_min_lead_hours": 4.0
      }
    }
  },
  "expected": {
    "suggestion_eligible": false,
    "notes": "0% remaining is empty capacity; not a burn winner"
  }
}
